<?xml version="1.0" encoding="UTF-8"?>
<opcua-servers xmlns:xsi="http://www.w3.org/2001/XMLSchema-instance" xsi:noNamespaceSchemaLocation="opcua-endpoints.xsd">

 <server>
    <server_app_uri>opc.tcp://172.16.4.52:4840</server_app_uri>
    <client_app_uri>urn:S7-1500-Siemens</client_app_uri>
    <alias>s7-1500-siemens-sps</alias>
    <security>
      <policy>SecurityPolicyNone</policy>
      <mode>None</mode>
    </security>
    <nodes>
  
      <node>
        <DisplayName>Produzierte_Takte</DisplayName>
        <NamespaceIndex>3</NamespaceIndex>
        <NamespaceAlias>S7-1500</NamespaceAlias>
        <IdentifierType>String</IdentifierType>
        <Identifier>"ProductionData"."Produzierte_Takte"</Identifier>
        <datatype>Int32</datatype>
        <description>Haifischfuetterung</description>
      </node>
      
    </nodes>
  </server>

  
</opcua-servers>